<?xml version="1.0" encoding="UTF-8"?>
<interaction xmlns="http://opends.eu/drivingtask/interaction"
		xmlns:xsi="http://www.w3.org/2001/XMLSchema-instance" 
        xsi:schemaLocation="http://opends.eu/drivingtask/interaction ../../Schema/interaction.xsd">

	<activities>
	</activities>
	
	<triggers>
		<trigger id="shutDownOnTargetPosition" priority="1">
			<activities>
				<activity id="shutDownOnTargetPosition">
					<action id="shutDownSimulation" delay="0" repeat="0">
					</action>
				</activity>
			</activities>
			<condition>
				<openDrivePos>
					<roadID>s002</roadID>
					<lane>-1</lane>
					<s>30.0</s>
				</openDrivePos>
			</condition>
		</trigger>
		<trigger id="shutDownOnRoadEnd_s001_lane_-1" priority="1">
			<activities>
				<activity id="shutDownOnRoadEnd_s001_lane_-1">
					<action id="shutDownSimulation" delay="0" repeat="0">
					</action>
				</activity>
			</activities>
			<condition>
				<openDrivePos>
					<roadID>s001</roadID>
					<lane>-1</lane>
					<s>100.988</s>
				</openDrivePos>
			</condition>
		</trigger>
		<trigger id="shutDownOnRoadEnd_s002_lane_-1" priority="1">
			<activities>
				<activity id="shutDownOnRoadEnd_s002_lane_-1">
					<action id="shutDownSimulation" delay="0" repeat="0">
					</action>
				</activity>
			</activities>
			<condition>
				<openDrivePos>
					<roadID>s002</roadID>
					<lane>-1</lane>
					<s>149.99</s>
				</openDrivePos>
			</condition>
		</trigger>
		<trigger id="shutDownOnRoadEnd_s003_lane_-1" priority="1">
			<activities>
				<activity id="shutDownOnRoadEnd_s003_lane_-1">
					<action id="shutDownSimulation" delay="0" repeat="0">
					</action>
				</activity>
			</activities>
			<condition>
				<openDrivePos>
					<roadID>s003</roadID>
					<lane>-1</lane>
					<s>150.988</s>
				</openDrivePos>
			</condition>
		</trigger>

	</triggers>
	
</interaction>